title,author,avg_rating,user_rating,cover_url,user_id
The Contest,"Easton, Bennett",5.0,5,https://i.gr-assets.com/images/S/compressed.photo.goodreads.com/books/1431693748l/25533364._SY75_.jpg,32340179
Unmuted: Stories of Courage and Resilience from the GenPRIDE Community,Genpride,4.79,5,https://i.gr-assets.com/images/S/compressed.photo.goodreads.com/books/1599946716l/55186439._SY75_.jpg,32340179
Vanishing: The World's Most Vulnerable Animals,"Sartore, Joel",4.78,5,https://i.gr-assets.com/images/S/compressed.photo.goodreads.com/books/1568123726l/43505593._SX50_.jpg,32340179
Eyes That Speak,"Bowe, Christy",4.77,5,https://i.gr-assets.com/images/S/compressed.photo.goodreads.com/books/1642142067l/50863895._SX50_.jpg,32340179
Hat,"Paule, Renée",4.76,5,https://i.gr-assets.com/images/S/compressed.photo.goodreads.com/books/1527065525l/40197283._SX50_.jpg,32340179
The Last Veterans of World War II: Portraits and Memories,"Bell, Richard",4.75,5,https://i.gr-assets.com/images/S/compressed.photo.goodreads.com/books/1493309380l/34916023._SX50_.jpg,32340179
The King and the Quirky,"Siegel, Heather",4.73,5,https://i.gr-assets.com/images/S/compressed.photo.goodreads.com/books/1575492080l/53052215._SX50_SY75_.jpg,32340179
Brown Girl Chromatography: Poems,"Bhowmik, Anuradha",4.71,5,https://i.gr-assets.com/images/S/compressed.photo.goodreads.com/books/1651979476l/60466636._SX50_.jpg,32340179
Nature Meditations Deck: Simple Mindfulness Practices Inspired by the Natural World,"Jackson-Saulters, Kenya",4.67,5,https://i.gr-assets.com/images/S/compressed.photo.goodreads.com/books/1622175893l/58182470._SX50_.jpg,32340179
Women: The National Geographic Image Collection,"Goldberg, Susan",4.66,5,https://i.gr-assets.com/images/S/compressed.photo.goodreads.com/books/1558869495l/43996876._SX50_.jpg,32340179
"Becoming Superman: My Journey from Poverty to Hollywood with Stops Along the Way at Murder, Madness, Mayhem, Movie Stars, Cults, Slums, Sociopaths, and War Crimes","Straczynski, J. Michael",4.64,0,https://i.gr-assets.com/images/S/compressed.photo.goodreads.com/books/1552088710l/42482167._SY75_.jpg,32340179
The Sun Does Shine: How I Found Life and Freedom on Death Row,"Hinton, Anthony Ray",4.64,5,https://i.gr-assets.com/images/S/compressed.photo.goodreads.com/books/1510275772l/36567136._SY75_.jpg,32340179
Keep Moving: The Journal: Thrive Through Change and Create a Life You Love,"Smith, Maggie",4.64,5,https://i.gr-assets.com/images/S/compressed.photo.goodreads.com/books/1632933208l/58271622._SX50_.jpg,32340179
"Kay Kay and the Euro Green Monster (Kay Kay, #2)",Talia,4.63,4,https://i.gr-assets.com/images/S/compressed.photo.goodreads.com/books/1380713411l/18620889._SY75_.jpg,32340179
Crazy Little Town Called Love,"Anderson, Jill Hannah",4.62,4,https://i.gr-assets.com/images/S/compressed.photo.goodreads.com/books/1524865205l/39980299._SY75_.jpg,32340179
Pawn in Frankincense (Lymond Chronicles #4),"Dunnett, Dorothy",4.62,0,https://i.gr-assets.com/images/S/compressed.photo.goodreads.com/books/1555685791l/43153002._SY75_.jpg,32340179
Lily's Promise: How I Survived Auschwitz and Found the Strength to Live,"Ebert, Lily",4.62,5,https://i.gr-assets.com/images/S/compressed.photo.goodreads.com/books/1617890141l/57666919._SY75_.jpg,32340179
The Nightingale,"Hannah, Kristin",4.61,5,https://i.gr-assets.com/images/S/compressed.photo.goodreads.com/books/1681839850l/21853621._SY75_.jpg,32340179
How to Survive Death and Other Inconveniences,"Silverman, Sue William",4.61,4,https://i.gr-assets.com/images/S/compressed.photo.goodreads.com/books/1576722879l/49515503._SY75_.jpg,32340179
National Geographic Stargazer's Atlas: The Ultimate Guide to the Night Sky,National Geographic Society,4.61,5,https://i.gr-assets.com/images/S/compressed.photo.goodreads.com/books/1656313440l/60382916._SX50_.jpg,32340179
The Disorderly Knights: Book Three in the Legendary Lymond Chronicles,"Dunnett, Dorothy",4.59,0,https://i.gr-assets.com/images/S/compressed.photo.goodreads.com/books/1677839704l/43153001._SY75_.jpg,32340179
The Blue Hour: A Novel,"Righettini, Vicki",4.58,4,https://i.gr-assets.com/images/S/compressed.photo.goodreads.com/books/1447273309l/27775379._SY75_.jpg,32340179
The Ringed Castle (Lymond Chronicles #5),"Dunnett, Dorothy",4.58,0,https://i.gr-assets.com/images/S/compressed.photo.goodreads.com/books/1561475563l/43153003._SY75_.jpg,32340179
Devotions: The Selected Poems of Mary Oliver,"Oliver, Mary",4.58,5,https://i.gr-assets.com/images/S/compressed.photo.goodreads.com/books/1494874103l/34272476._SY75_.jpg,32340179
I Died Twice,"Underwood, Bobby",4.57,4,https://i.gr-assets.com/images/S/compressed.photo.goodreads.com/books/1493105218l/34953413._SY75_.jpg,32340179
Dragonfly Escaping: Noor's Story: Book One,"Khedker, Raya",4.57,4,https://i.gr-assets.com/images/S/compressed.photo.goodreads.com/books/1652511213l/61090975._SX50_.jpg,32340179
"The Boy, the Mole, the Fox and the Horse","Mackesy, Charlie",4.56,5,https://i.gr-assets.com/images/S/compressed.photo.goodreads.com/books/1579017235l/43708884._SX50_.jpg,32340179
By Chance Alone: A Remarkable True Story of Courage and Survival at Auschwitz,"Eisen, Max",4.56,0,https://i.gr-assets.com/images/S/compressed.photo.goodreads.com/books/1454881311l/25989446._SX50_.jpg,32340179
By Chance Alone: A Remarkable True Story of Courage and Survival at Auschwitz,"Eisen, Max",4.56,0,https://i.gr-assets.com/images/S/compressed.photo.goodreads.com/books/1554343076l/31449192._SY75_.jpg,32340179
Don’t Forget to Write,"Confino, Sara Goodman",4.55,5,https://i.gr-assets.com/images/S/compressed.photo.goodreads.com/books/1682262699l/75349380._SY75_.jpg,32340179
The House On Sun Street,"Ghazirad, Mojgan",4.5,4,https://i.gr-assets.com/images/S/compressed.photo.goodreads.com/books/1682388783l/123726346._SX50_.jpg,32340179
"Payback in Death (In Death, #57)","Robb, J.D.",4.54,5,https://i.gr-assets.com/images/S/compressed.photo.goodreads.com/books/1677109121l/75260734._SY75_.jpg,32340179
Tender Cuts,"Martin, Jayne",4.54,4,https://i.gr-assets.com/images/S/compressed.photo.goodreads.com/books/1564405095l/52727064._SX50_SY75_.jpg,32340179
"Ninth Street Women: Lee Krasner, Elaine de Kooning, Grace Hartigan, Joan Mitchell, and Helen Frankenthaler: Five Painters and the Movement That Changed Modern Art","Gabriel, Mary",4.52,5,https://i.gr-assets.com/images/S/compressed.photo.goodreads.com/books/1522682968l/28118491._SY75_.jpg,32340179
Lonesome Dove,"McMurtry, Larry",4.52,0,https://i.gr-assets.com/images/S/compressed.photo.goodreads.com/books/1389593878l/19146797._SY75_.jpg,32340179
Trooper: The Bobcat Who Came in from the Wild,"Johnson, Forrest Bryant",4.52,5,https://i.gr-assets.com/images/S/compressed.photo.goodreads.com/books/1503201594l/36072751._SX50_.jpg,32340179
"Atlas: The Story of Pa Salt (The Seven Sisters, #8)","Riley, Lucinda",4.52,5,https://i.gr-assets.com/images/S/compressed.photo.goodreads.com/books/1666535049l/58528573._SX50_.jpg,32340179
The Love Songs of W.E.B. Du Bois,"Jeffers, Honorée Fanonne",4.52,5,https://i.gr-assets.com/images/S/compressed.photo.goodreads.com/books/1629809930l/51183428._SY75_.jpg,32340179
Let's Hatch Chicks!: Explore the Wonderful World of Chickens and Eggs,Lisa Steele,4.52,5,https://i.gr-assets.com/images/S/compressed.photo.goodreads.com/books/1516960304l/35488216._SX50_.jpg,32340179
The Things We Cannot Say,"Rimmer, Kelly",4.52,5,https://i.gr-assets.com/images/S/compressed.photo.goodreads.com/books/1532268231l/40899464._SY75_.jpg,32340179
The Spy and the Traitor: The Greatest Espionage Story of the Cold War,"Macintyre, Ben",4.51,0,https://i.gr-assets.com/images/S/compressed.photo.goodreads.com/books/1565081761l/51770358._SX50_SY75_.jpg,32340179
In the Doghouse: A Couple's Breakup from Their Dog's Point of View,"Case, Teri",4.51,4,https://i.gr-assets.com/images/S/compressed.photo.goodreads.com/books/1549631133l/43891376._SY75_.jpg,32340179
A Life Unraveled,"Anderson, Jill Hannah",4.5,4,https://i.gr-assets.com/images/S/compressed.photo.goodreads.com/books/1643680847l/57116903._SY75_.jpg,32340179
Embers: One Ojibway's Meditations,"Wagamese, Richard",4.5,0,https://i.gr-assets.com/images/S/compressed.photo.goodreads.com/books/1473929766l/31374734._SY75_.jpg,32340179
Béla's Letters,"Ingber, Jeff",4.5,0,https://i.gr-assets.com/images/S/compressed.photo.goodreads.com/books/1455893523l/29224133._SY75_.jpg,32340179
Witness: Lessons from Elie Wiesel's Classroom,"Burger, Ariel",4.5,5,https://i.gr-assets.com/images/S/compressed.photo.goodreads.com/books/1519637234l/37570564._SX50_.jpg,32340179
Van Gogh and the Artists He Loved,"Naifeh, Steven",4.5,5,https://i.gr-assets.com/images/S/compressed.photo.goodreads.com/books/1622418456l/57005208._SX50_.jpg,32340179
Solito,"Zamora, Javier",4.5,5,https://i.gr-assets.com/images/S/compressed.photo.goodreads.com/books/1643985393l/59900688._SY75_.jpg,32340179
"From the Ashes: My Story of Being Métis, Homeless, and Finding My Way","Thistle, Jesse",4.5,5,https://i.gr-assets.com/images/S/compressed.photo.goodreads.com/books/1561088373l/52149264._SX50_SY75_.jpg,32340179
Savor: A Chef's Hunger for More,"Ali, Fatima",4.5,5,https://i.gr-assets.com/images/S/compressed.photo.goodreads.com/books/1658755495l/60149549._SY75_.jpg,32340179
"The Winter of the Witch (The Winternight Trilogy, #3)","Arden, Katherine",4.5,5,https://i.gr-assets.com/images/S/compressed.photo.goodreads.com/books/1517001188l/36621586._SY75_.jpg,32340179
The Precious Jules,"Nocher, Shawn",4.49,4,https://i.gr-assets.com/images/S/compressed.photo.goodreads.com/books/1651701022l/61033585._SY75_.jpg,32340179
Piney the Goat Nanny: a True Story of a Little Pig With a Big Heart,"Lauricella, Leanne",4.49,5,https://i.gr-assets.com/images/S/compressed.photo.goodreads.com/books/1516332721l/35397903._SX50_.jpg,32340179
The Lady and the Lionheart,"Bischof, Joanne",4.49,4,https://i.gr-assets.com/images/S/compressed.photo.goodreads.com/books/1469138538l/27261345._SY75_.jpg,32340179
The Lady and the Lionheart,"Bischof, Joanne",4.49,4,https://i.gr-assets.com/images/S/compressed.photo.goodreads.com/books/1468601342l/30344013._SY75_.jpg,32340179
The Last Green Valley,"Sullivan, Mark T.",4.49,4,https://i.gr-assets.com/images/S/compressed.photo.goodreads.com/books/1604715878l/54362408._SY75_.jpg,32340179
"The Kristin Hannah Collection: Volume 1: Firefly Lane, True Colors, Fly Away","Hannah, Kristin",4.49,0,https://i.gr-assets.com/images/S/compressed.photo.goodreads.com/books/1439645071l/24319522._SX50_.jpg,32340179
The Keeper of Happy Endings,"Davis, Barbara",4.48,4,https://i.gr-assets.com/images/S/compressed.photo.goodreads.com/books/1619162962l/57305360._SX50_.jpg,32340179
My Dad My Dog,"Warner, Rebecca",4.48,4,https://i.gr-assets.com/images/S/compressed.photo.goodreads.com/books/1601318236l/55501039._SY75_.jpg,32340179
I'm Glad My Mom Died,"McCurdy, Jennette",4.48,4,https://i.gr-assets.com/images/S/compressed.photo.goodreads.com/books/1649286799l/59364173._SY75_.jpg,32340179
"Mission Critical (Gray Man, #8)","Greaney, Mark",4.48,4,https://i.gr-assets.com/images/S/compressed.photo.goodreads.com/books/1527919746l/40187317._SY75_.jpg,32340179
Homegoing,"Gyasi, Yaa",4.47,5,https://i.gr-assets.com/images/S/compressed.photo.goodreads.com/books/1448108591l/27071490._SY75_.jpg,32340179
Homegoing,"Gyasi, Yaa",4.47,0,https://i.gr-assets.com/images/S/compressed.photo.goodreads.com/books/1633711668l/34879224._SX50_.jpg,32340179
The World Played Chess,"Dugoni, Robert",4.47,4,https://i.gr-assets.com/images/S/compressed.photo.goodreads.com/books/1617836952l/56576966._SX50_.jpg,32340179
The World Played Chess,"Dugoni, Robert",4.47,4,https://i.gr-assets.com/images/S/compressed.photo.goodreads.com/books/1620928356l/56576973._SY75_.jpg,32340179
The Help,"Stockett, Kathryn",4.47,5,https://i.gr-assets.com/images/S/compressed.photo.goodreads.com/books/1622355533l/4667024._SY75_.jpg,32340179
Becoming,"Obama, Michelle",4.47,5,https://i.gr-assets.com/images/S/compressed.photo.goodreads.com/books/1528206996l/38746485._SY75_.jpg,32340179
Educated,"Westover, Tara",4.47,5,https://i.gr-assets.com/images/S/compressed.photo.goodreads.com/books/1506026635l/35133922._SY75_.jpg,32340179
How to Say Babylon: A Memoir,"Sinclair, Safiya",4.47,5,https://i.gr-assets.com/images/S/compressed.photo.goodreads.com/books/1696364131l/62919742._SX50_.jpg,32340179
Broken Angels,"Liviero, Gemma",4.47,4,https://i.gr-assets.com/images/S/compressed.photo.goodreads.com/books/1455790073l/27852570._SX50_.jpg,32340179
"The China Study Cookbook: Revised and Expanded Edition with Over 175 Whole Food, Plant-Based Recipes","Campbell, LeAnne",4.47,5,https://i.gr-assets.com/images/S/compressed.photo.goodreads.com/books/1515306145l/37845934._SX50_.jpg,32340179
"The Josephine Bonaparte Collection: The Many Lives and Secret Sorrows of Josephine B., Tales of Passion, Tales of Woe, and the Last Great Dance on Earth",Sandra Gulland,4.46,5,https://i.gr-assets.com/images/S/compressed.photo.goodreads.com/books/1388637739l/70288._SX50_.jpg,32340179
"An Exaltation of Larks (Venery, #1)","Laqueur, Suanne",4.46,5,https://i.gr-assets.com/images/S/compressed.photo.goodreads.com/books/1475940614l/29637128._SX50_.jpg,32340179
The Invincible Summer of Juniper Jones,"McQueen, Daven",4.46,5,https://i.gr-assets.com/images/S/compressed.photo.goodreads.com/books/1591212434l/53805921._SY75_.jpg,32340179
The Dreaming Road,"Moore, Elizabeth",4.46,4,https://i.gr-assets.com/images/S/compressed.photo.goodreads.com/books/1511618509l/36659396._SY75_.jpg,32340179
"Search for Treasure (The Islanders, #2)","Monroe, Mary Alice",4.46,5,https://i.gr-assets.com/images/S/compressed.photo.goodreads.com/books/1636824170l/59610803._SY75_.jpg,32340179
The Hiding Place: The Triumphant True Story of Corrie Ten Boom,"ten Boom, Corrie",4.45,5,https://i.gr-assets.com/images/S/compressed.photo.goodreads.com/books/1320418824l/561909._SY75_.jpg,32340179
Queens' Play (The Lymond Chronicles #2),"Dunnett, Dorothy",4.45,0,https://i.gr-assets.com/images/S/compressed.photo.goodreads.com/books/1557478264l/43153000._SY75_.jpg,32340179
Our Prince of Scribes: Writers Remember Pat Conroy,"Seitz, Nicole A.",4.45,5,https://i.gr-assets.com/images/S/compressed.photo.goodreads.com/books/1534318948l/39816266._SY75_.jpg,32340179
"Heart Talk: The Journal: 52 Weeks of Self-Love, Self-Care, and Self-Discovery","Wade, Cleo",4.45,0,https://i.gr-assets.com/images/S/compressed.photo.goodreads.com/books/1595162281l/52759745._SX50_.jpg,32340179
"Heart Talk: The Journal: 52 Weeks of Self-Love, Self-Care, and Self-Discovery","Wade, Cleo",4.45,5,https://i.gr-assets.com/images/S/compressed.photo.goodreads.com/books/1590966978l/53715693._SX50_.jpg,32340179
"Power Blender Revolution: More Than 300 Healthy and Amazing Recipes That Unlock the Full Potential of Your Vitamix, Blendtec, Ninja, or Other High-Speed, High-Power Blender","Simkins, Vanessa",4.45,5,https://i.gr-assets.com/images/S/compressed.photo.goodreads.com/books/1518216524l/36204925._SX50_.jpg,32340179
"One Minute Out (Gray Man, #9)","Greaney, Mark",4.45,5,https://i.gr-assets.com/images/S/compressed.photo.goodreads.com/books/1565308019l/46008456._SY75_.jpg,32340179
To Lay to Rest Our Ghosts,"Summie, Caitlin Hamilton",4.45,5,https://i.gr-assets.com/images/S/compressed.photo.goodreads.com/books/1492723939l/34913559._SY75_.jpg,32340179
Geographies of the Heart,"Summie, Caitlin Hamilton",4.45,5,https://i.gr-assets.com/images/S/compressed.photo.goodreads.com/books/1630678779l/58917847._SY75_.jpg,32340179
"Big Trouble on Sullivan's Island (Carolina Tales, #1)","Boyer, Susan M.",4.45,5,https://i.gr-assets.com/images/S/compressed.photo.goodreads.com/books/1676405483l/118540307._SY75_.jpg,32340179
These Precious Days: Essays,"Patchett, Ann",4.45,5,https://i.gr-assets.com/images/S/compressed.photo.goodreads.com/books/1621841000l/56922687._SY75_.jpg,32340179
In the Dream House,"Machado, Carmen Maria",4.44,5,https://i.gr-assets.com/images/S/compressed.photo.goodreads.com/books/1547869259l/43317482._SX50_.jpg,32340179
The Anxiety Diaries (#1),"Muwwakkil, Dana",4.44,5,https://i.gr-assets.com/images/S/compressed.photo.goodreads.com/books/1601916507l/54675846._SY75_.jpg,32340179
Promises of Gold,"Olivarez, José",4.44,5,https://i.gr-assets.com/images/S/compressed.photo.goodreads.com/books/1663129533l/60784597._SY75_.jpg,32340179
The Girl with the Louding Voice,"Daré, Abi",4.44,5,https://i.gr-assets.com/images/S/compressed.photo.goodreads.com/books/1581128232l/50214741._SY75_.jpg,32340179
How Not to Die: Discover the Foods Scientifically Proven to Prevent and Reverse Disease,"Greger, Michael",4.44,5,https://i.gr-assets.com/images/S/compressed.photo.goodreads.com/books/1436292289l/25663961._SY75_.jpg,32340179
"Black Fatigue: How Racism Erodes the Mind, Body, and Spirit","Winters, Mary-Frances",4.44,5,https://i.gr-assets.com/images/S/compressed.photo.goodreads.com/books/1589261238l/51773973._SY75_.jpg,32340179
The Seven Husbands of Evelyn Hugo,"Reid, Taylor Jenkins",4.44,5,https://i.gr-assets.com/images/S/compressed.photo.goodreads.com/books/1664458703l/32620332._SY75_.jpg,32340179
Against the Loveless World,"Abulhawa, Susan",4.43,5,https://i.gr-assets.com/images/S/compressed.photo.goodreads.com/books/1571573089l/52761023._SY75_.jpg,32340179
"A Pocket Watch, Spray Paint & Morphine: How Viv the Librarian Weathers the Boom","Lynne, Kimberly",4.43,5,https://i.gr-assets.com/images/S/compressed.photo.goodreads.com/books/1537151049l/41860541._SX50_.jpg,32340179
The String Games,"Aldwin, Gail",4.43,4,https://i.gr-assets.com/images/S/compressed.photo.goodreads.com/books/1550761624l/44081576._SY75_.jpg,32340179
"Echoes in Death (In Death, #44)","Robb, J.D.",4.43,5,https://i.gr-assets.com/images/S/compressed.photo.goodreads.com/books/1470746068l/31384635._SY75_.jpg,32340179
A Collar for Cerberus,"Stanley, Matt",4.44,5,https://i.gr-assets.com/images/S/compressed.photo.goodreads.com/books/1527028162l/40195147._SY75_.jpg,32340179
The Extraordinary Life of Sam Hell,"Dugoni, Robert",4.43,4,https://i.gr-assets.com/images/S/compressed.photo.goodreads.com/books/1510251600l/35995489._SY75_.jpg,32340179
